{
  "schema_version": "9702_p1_enrichment_v1",
  "question_id": "9702_w17_12_q37",
  "component": "P1",
  "difficulty": 3,
  "question_patterns": [
    "circuit_analysis"
  ],
  "topic_id": "9702_t10",
  "module_id": "9702_t10_m02",
  "skill_id": "9702_skill_kirchhoffs_laws",
  "accepted_answer": "B",
  "options_breakdown": {
    "A": {
      "status": "incorrect",
      "explanation": "Gives $R = 3.0\\,\\Omega$ by mis-combining the $3.0\\,\\text{A}$, $0.5\\,\\text{A}$ and $4.0\\,\\text{A}$ branch currents or the $10\\,\\text{V}$ network p.d."
    },
    "B": {
      "status": "correct",
      "explanation": "The two $R$ resistors carry $1.0\\,\\text{A}$ and $1.5\\,\\text{A}$ and together drop the $10\\,\\text{V}$ across the network, giving $R = 4.0\\,\\Omega$."
    },
    "C": {
      "status": "incorrect",
      "explanation": "Gives $R = 4.8\\,\\Omega$ by using an incorrect branch current or an incorrect share of the $12.0\\,\\text{V}$ e.m.f. after the $0.50\\,\\Omega$ drop."
    },
    "D": {
      "status": "incorrect",
      "explanation": "Gives $R = 5.0\\,\\Omega$ by assuming each $R$ carries $1.0\\,\\text{A}$ with $10\\,\\text{V}$ across the pair, ignoring the $0.5\\,\\text{A}$ in S."
    }
  },
  "hints": [
    "Look at the left junction where the $4.0\\,\\text{A}$ supply current splits into $3.0\\,\\text{A}$ in the upper branch and an unknown current in the lower $R$.",
    "Use Kirchhoff's current law at the centre top and centre bottom junctions with the $0.5\\,\\text{A}$ in S to find the currents in both resistors labelled $R$.",
    "Subtract the $I \\times 0.50\\,\\Omega$ drop from the $12.0\\,\\text{V}$ supply to get the p.d. between the outer left and right nodes, then apply $V = IR$ to the lower path containing the two $R$ resistors in series."
  ],
  "walkthrough": [
    "Apply Kirchhoff's first law at the left node. $4.0\\,\\text{A}$ enters and $3.0\\,\\text{A}$ leaves in the upper branch, so the lower left resistor $R$ carries $4.0 - 3.0 = 1.0\\,\\text{A}$.",
    "Apply Kirchhoff's first law at the centre top node. $3.0\\,\\text{A}$ enters from the left and $0.5\\,\\text{A}$ leaves down through S, so the upper right branch carries $3.0 - 0.5 = 2.5\\,\\text{A}$ to the right.",
    "Apply Kirchhoff's first law at the centre bottom node. $1.0\\,\\text{A}$ enters from the left $R$ and $0.5\\,\\text{A}$ enters from S, so $1.5\\,\\text{A}$ must leave through the lower right resistor $R$.",
    "Use Kirchhoff's second law for the supply loop. The drop in the $0.50\\,\\Omega$ resistor is $V = IR = 4.0 \\times 0.50 = 2.0\\,\\text{V}$, so the p.d. between the outer left and right nodes is $12.0 - 2.0 = 10.0\\,\\text{V}$.",
    "Follow the lower path from left node to right node through the two $R$ resistors in series. The total drop is $1.0R + 1.5R = 2.5R$.",
    "Set this equal to the network p.d.: $2.5R = 10.0\\,\\text{V}$, so $R = 10.0 / 2.5 = 4.0\\,\\Omega$. This is option B."
  ],
  "mapping": {
    "primary_topic_id": "9702_t10",
    "primary_module_id": "9702_t10_m02",
    "outcome_ids": [
      "9702_t10_m02_o03",
      "9702_t10_m02_o05"
    ]
  },
  "taxonomy_tags": {
    "topic_ids": [
      "9702_t10"
    ],
    "module_ids": [
      "9702_t10_m02"
    ]
  }
}
