{
  "schema_version": "9702_p1_enrichment_v1",
  "question_id": "9702_w20_13_q16",
  "component": "P1",
  "difficulty": 2,
  "question_patterns": [
    "explanation"
  ],
  "topic_id": "9702_t05",
  "module_id": "9702_t05_m02",
  "skill_id": "9702_skill_conservation_of_energy",
  "accepted_answer": "B",
  "options_breakdown": {
    "A": {
      "status": "incorrect",
      "explanation": "An elastic bounce means very little energy is dissipated, so most kinetic energy is not permanently lost as heat and sound."
    },
    "B": {
      "status": "correct",
      "explanation": "The ball is brought momentarily to rest then re-accelerated upward, so its $\\frac{1}{2}mv^2$ falls to zero and is then fully restored."
    },
    "C": {
      "status": "incorrect",
      "explanation": "Elastic means total kinetic energy before equals total after, but during contact kinetic energy is temporarily stored as elastic potential energy."
    },
    "D": {
      "status": "incorrect",
      "explanation": "Kinetic energy is a scalar with no direction, so it cannot change direction - it is velocity that reverses."
    }
  },
  "hints": [
    "Focus on the phrase during the very short time that it is in contact, not just the speed just before and just after the bounce.",
    "Think about what the velocity of the ball must do to reverse from downwards to upwards, and how $E_k = \\frac{1}{2}mv^2$ depends on speed.",
    "Think about where the energy goes while the ball is squashed against the surface in an elastic impact if it is not lost."
  ],
  "walkthrough": [
    "Identify the motion: the ball arrives with downward speed $v$, must stop moving down and then leave with upward speed $v$ because the bounce is described as elastic.",
    "Recall the rule for translational kinetic energy: $E_k = \\frac{1}{2}mv^2$, so $E_k$ depends on $(speed)^2$ and is zero only when speed is zero.",
    "During contact the surface exerts an upward force that first decelerates the ball to zero speed at maximum squash, so $E_k$ decreases to zero.",
    "By conservation of energy the lost $E_k$ is temporarily stored as elastic potential energy in the deformed ball and surface, not dissipated.",
    "That stored energy then does work to accelerate the ball upward back to its original speed, so $E_k$ increases back to its original value for an elastic collision.",
    "Therefore $E_k$ dips to zero and returns, which matches the description given. This is option B."
  ],
  "mapping": {
    "primary_topic_id": "9702_t05",
    "primary_module_id": "9702_t05_m02",
    "outcome_ids": [
      "9702_t05_m02_o03",
      "9702_t05_m02_o02"
    ]
  },
  "taxonomy_tags": {
    "topic_ids": [
      "9702_t05"
    ],
    "module_ids": [
      "9702_t05_m02"
    ]
  }
}
