{
  "schema_version": "9702_p1_enrichment_v1",
  "question_id": "9702_m21_12_q32",
  "component": "P1",
  "difficulty": 1,
  "question_patterns": [
    "definition"
  ],
  "topic_id": "9702_t09",
  "module_id": "9702_t09_m01",
  "skill_id": "9702_skill_electric_current_drift_speed",
  "accepted_answer": "D",
  "options_breakdown": {
    "A": {
      "status": "incorrect",
      "explanation": "Total number in the wire depends on the size of the wire, while $n$ in $I = Anvq$ is a material property independent of size."
    },
    "B": {
      "status": "incorrect",
      "explanation": "Carriers per unit area omits the length dimension, so multiplying by area $A$ alone could not give the total charge passing per second."
    },
    "C": {
      "status": "incorrect",
      "explanation": "Carriers per unit length multiplied by $A$ would give units of $\\text{m}$ times number per $\\text{m}$, which does not describe concentration in the 3D wire."
    },
    "D": {
      "status": "correct",
      "explanation": "In $I = Anvq$, $n$ is the number density of charge carriers, the number per unit volume with unit $\\text{m}^{-3}$."
    }
  },
  "hints": [
    "Notice the equation $I = Anvq$ already contains $A$, the cross-sectional area of the wire, so $n$ must supply what $A$ alone does not.",
    "Think of current as charge passing per second: carriers in volume $Av\\Delta t$ each of charge $q$ pass in time $\\Delta t$ at drift speed $v$.",
    "Check units: for $Anvq$ to give ampere, $n$ must have unit $\\text{m}^{-3}$ to cancel the $\\text{m}^2$ from $A$ and $\\text{m s}^{-1}$ from $v$."
  ],
  "walkthrough": [
    "Identify the symbols in $I = Anvq$: $A$ is cross-sectional area, $v$ is mean drift speed, $q$ is charge per carrier, and $I$ is charge per unit time.",
    "Consider a length $l = v\\Delta t$ of wire: the volume containing carriers that pass a point in time $\\Delta t$ is $Volume = A l = Av\\Delta t$.",
    "If $n$ is number per unit volume, total carriers in that volume is $nAv\\Delta t$ and total charge is $nAv\\Delta t q$.",
    "Divide by $\\Delta t$ to get current $I = nAvq$, which matches the given equation and gives correct units of $\\text{A}$.",
    "Options A, B and C give total number, number per area, or number per length, none of which makes $Anvq$ dimensionally correct or independent of wire size. This is option D"
  ],
  "mapping": {
    "primary_topic_id": "9702_t09",
    "primary_module_id": "9702_t09_m01",
    "outcome_ids": [
      "9702_t09_m01_o04",
      "9702_t09_m01_o01"
    ]
  },
  "taxonomy_tags": {
    "topic_ids": [
      "9702_t09"
    ],
    "module_ids": [
      "9702_t09_m01"
    ]
  }
}
