{
  "schema_version": "9702_p1_enrichment_v1",
  "question_id": "9702_w20_12_q32",
  "component": "P1",
  "difficulty": 1,
  "question_patterns": [
    "comparison"
  ],
  "topic_id": "9702_t09",
  "module_id": "9702_t09_m03",
  "skill_id": "9702_skill_uniform_electric_fields",
  "accepted_answer": "B",
  "options_breakdown": {
    "A": {
      "status": "incorrect",
      "explanation": "Potential difference is constant, but field strength does not decrease when separation decreases for fixed $V$."
    },
    "B": {
      "status": "correct",
      "explanation": "Potential difference stays equal to the battery e.m.f. and $E = V/d$ increases as separation $d$ decreases."
    },
    "C": {
      "status": "incorrect",
      "explanation": "Neither change is correct for plates still connected to the battery; $V$ does not increase and $E$ does not decrease."
    },
    "D": {
      "status": "incorrect",
      "explanation": "Field strength does increase, but potential difference does not increase because it is fixed by the battery."
    }
  },
  "hints": [
    "Notice the wires in the diagram keep both metal plates connected to the battery while the separation is reduced.",
    "Think what fixes the potential difference between the plates when internal resistance is negligible and the battery e.m.f. is unchanged.",
    "Recall $E = V/d$ for a uniform field between parallel plates and ask what happens if $V$ is fixed and $d$ gets smaller."
  ],
  "walkthrough": [
    "Identify the set-up: the two metal plates remain connected across the battery, so the plate separation $d$ decreases while the battery stays in the circuit.",
    "State the rule for potential difference: with negligible internal resistance, the terminal p.d. equals the battery e.m.f., so $V$ between the plates stays constant.",
    "State the rule for uniform field strength: $E = V/d$, where $V$ is the plate p.d. and $d$ is the perpendicular separation.",
    "Apply the change: $V$ is constant and $d$ decreases, so the fraction $V/d$ becomes larger and $E$ increases.",
    "Match to the table: electric field strength increases and potential difference is constant. This is option B."
  ],
  "mapping": {
    "primary_topic_id": "9702_t09",
    "primary_module_id": "9702_t09_m03",
    "outcome_ids": [
      "9702_t09_m03_o04",
      "9702_t09_m03_o07"
    ]
  },
  "taxonomy_tags": {
    "topic_ids": [
      "9702_t09"
    ],
    "module_ids": [
      "9702_t09_m03"
    ]
  }
}
