{
  "schema_version": "9702_p1_enrichment_v1",
  "question_id": "9702_w18_11_q21",
  "component": "P1",
  "difficulty": 1,
  "question_patterns": [
    "graph_interpretation"
  ],
  "topic_id": "9702_t07",
  "module_id": "9702_t07_m01",
  "skill_id": "9702_skill_progressive_wave_properties",
  "accepted_answer": "D",
  "options_breakdown": {
    "A": {
      "status": "incorrect",
      "explanation": "Intensity is proportional to $(amplitude)^2$, so amplitude is proportional to $\\sqrt{intensity}$, not directly proportional to intensity."
    },
    "B": {
      "status": "incorrect",
      "explanation": "For fixed speed $v = f\\lambda$, frequency $f = v/\\lambda$ is inversely proportional to wavelength, giving a hyperbola not a straight line through the origin."
    },
    "C": {
      "status": "incorrect",
      "explanation": "Speed of sound in air is fixed by the medium and does not increase with frequency, so the graph would be horizontal not proportional."
    },
    "D": {
      "status": "correct",
      "explanation": "With $v = \\lambda / T$, wavelength $\\lambda = vT$ is directly proportional to period $T$ for constant speed $v$."
    }
  },
  "hints": [
    "Notice the $P$ against $Q$ graph is a straight line through the origin, so you need $P$ directly proportional to $Q$.",
    "Remember the speed of a sound wave in air is constant, governed by $v = f\\lambda = \\lambda / T$.",
    "Check each pair for direct proportionality and reject the inverse relation between frequency and wavelength and the square relation between intensity and amplitude."
  ],
  "walkthrough": [
    "The graph shows $P = 0$ when $Q = 0$ and $P$ increases linearly with $Q$, so the test is $P \\propto Q$.",
    "For sound in air the wave speed $v$ is fixed by the medium, so use $v = f\\lambda$ and $T = 1/f$ to give $v = \\lambda / T$.",
    "Rearranging gives $\\lambda = vT$, so with constant $v$ wavelength is directly proportional to period.",
    "Intensity $\\propto (amplitude)^2$ is non-linear, $f \\propto 1/\\lambda$ is inverse, and speed is independent of frequency, so none of those pairs gives a line through the origin.",
    "Only wavelength against period fits $P \\propto Q$. This is option D."
  ],
  "mapping": {
    "primary_topic_id": "9702_t07",
    "primary_module_id": "9702_t07_m01",
    "outcome_ids": [
      "9702_t07_m01_o04",
      "9702_t07_m01_o02"
    ]
  },
  "taxonomy_tags": {
    "topic_ids": [
      "9702_t07"
    ],
    "module_ids": [
      "9702_t07_m01"
    ]
  }
}
