{
  "schema_version": "9702_p1_enrichment_v1",
  "question_id": "9702_w20_13_q24",
  "component": "P1",
  "difficulty": 1,
  "question_patterns": [
    "multi_step_calculation"
  ],
  "topic_id": "9702_t07",
  "module_id": "9702_t07_m01",
  "skill_id": "9702_skill_oscilloscope_traces",
  "accepted_answer": "B",
  "options_breakdown": {
    "A": {
      "status": "incorrect",
      "explanation": "Gives half the correct frequency, from using $20 \\text{ ms}$ for the period instead of $10 \\text{ ms}$."
    },
    "B": {
      "status": "correct",
      "explanation": "Period is $10 \\text{ ms}$ so $f = 1/T = 100 \\text{ Hz}$."
    },
    "C": {
      "status": "incorrect",
      "explanation": "Gives double the correct frequency, from using $2 \\text{ cm}$ for one cycle instead of $4 \\text{ cm}$."
    },
    "D": {
      "status": "incorrect",
      "explanation": "Gives four times the correct frequency, from using $1 \\text{ cm}$ for one cycle instead of $4 \\text{ cm}$."
    }
  },
  "hints": [
    "Count horizontal squares for one full sine wave from a repeating point, such as peak to next peak, noting each square is $1 \\text{ cm}$ wide.",
    "Multiply that $4 \\text{ cm}$ length by the time-base $2.5 \\text{ ms cm}^{-1}$ to get the period $T$ in $\\text{ms}$.",
    "Use $f = 1/T$ with $T$ converted to seconds to find the frequency in $\\text{Hz}$."
  ],
  "walkthrough": [
    "Identify one complete cycle on the CRO trace. From one peak to the next peak is $4$ squares, and each square is $1 \\text{ cm}$, so wavelength on screen is $4 \\text{ cm}$.",
    "State the rule: horizontal distance x time-base = time. Period $T = \\text{length} \\times \\text{time-base}$.",
    "Substitute values with units: $T = 4 \\text{ cm} \\times 2.5 \\text{ ms cm}^{-1} = 10 \\text{ ms}$.",
    "Convert to seconds: $T = 10 \\times 10^{-3} \\text{ s} = 0.010 \\text{ s}$.",
    "Use $f = 1/T = 1/0.010 = 100 \\text{ Hz}$. This is option B."
  ],
  "mapping": {
    "primary_topic_id": "9702_t07",
    "primary_module_id": "9702_t07_m01",
    "outcome_ids": [
      "9702_t07_m01_o03",
      "9702_t07_m01_o04"
    ]
  },
  "taxonomy_tags": {
    "topic_ids": [
      "9702_t07"
    ],
    "module_ids": [
      "9702_t07_m01"
    ]
  }
}
